{
  "run_id": "run_20261027_100000",
  "scenario_id": "login_flow",
  "schema_version": "2.0",
  "status": "passed",
  "metadata": {
    "app_version": "1.4.0",
    "device_model": "Pixel 8",
    "api_level": "36",
    "environment": "staging",
    "timestamp": "2026-10-27T10:00:00.000Z"
  },
  "total_assertions": 2,
  "passed_assertions": 2,
  "failed_assertions": 0,
  "duration_seconds": 12.5,
  "steps_executed": [
    { "step_id": "launch", "status": "passed", "screenshot": null, "error_message": null, "retried": false, "retry_count": 0 },
    { "step_id": "tap_login", "status": "passed", "screenshot": null, "error_message": null, "retried": false, "retry_count": 0 }
  ],
  "assertion_results": [
    { "assertion_id": "assert_home_visible", "status": "passed", "expected": null, "actual": null, "message": "Home is visible" },
    { "assertion_id": "assert_greeting", "status": "passed", "expected": "Hello", "actual": "Hello", "message": "" }
  ],
  "observations": [],
  "captured_variables": {},
  "summary": "passed: 2/2 assertion(s) passed across 2 step(s)."
}
